2026-01-20 13:53:45,104 p=507640 u=joel-livingstone-kofi-ackah n=ansible WARNING| [WARNING]: Deprecation warnings can be disabled by setting `deprecation_warnings=False` in ansible.cfg.

2026-01-20 13:53:45,104 p=507640 u=joel-livingstone-kofi-ackah n=ansible INFO| [DEPRECATION WARNING]: community.general.yaml has been deprecated. The plugin has been superseded by the option `result_format=yaml` in callback plugin ansible.builtin.default from ansible-core 2.13 onwards. This feature will be removed from collection 'community.general' version 12.0.0.

2026-01-20 13:53:45,184 p=507640 u=joel-livingstone-kofi-ackah n=ansible INFO| PLAY [Ansible Ad-Hoc] ****************************************************************************************************************************************************
2026-01-20 13:53:45,196 p=507640 u=joel-livingstone-kofi-ackah n=ansible INFO| TASK [ping] **************************************************************************************************************************************************************
2026-01-20 13:53:51,128 p=507640 u=joel-livingstone-kofi-ackah n=ansible INFO| ok: [webapp]
2026-01-20 13:53:51,131 p=507640 u=joel-livingstone-kofi-ackah n=ansible INFO| PLAY RECAP ***************************************************************************************************************************************************************
2026-01-20 13:53:51,131 p=507640 u=joel-livingstone-kofi-ackah n=ansible INFO| webapp                     : ok=1    changed=0    unreachable=0    failed=0    skipped=0    rescued=0    ignored=0   
2026-01-20 14:16:50,491 p=517284 u=joel-livingstone-kofi-ackah n=ansible WARNING| [WARNING]: Deprecation warnings can be disabled by setting `deprecation_warnings=False` in ansible.cfg.

2026-01-20 14:16:50,491 p=517284 u=joel-livingstone-kofi-ackah n=ansible INFO| [DEPRECATION WARNING]: community.general.yaml has been deprecated. The plugin has been superseded by the option `result_format=yaml` in callback plugin ansible.builtin.default from ansible-core 2.13 onwards. This feature will be removed from collection 'community.general' version 12.0.0.

2026-01-20 14:16:50,549 p=517284 u=joel-livingstone-kofi-ackah n=ansible INFO| PLAY [Ansible Ad-Hoc] ****************************************************************************************************************************************************
2026-01-20 14:16:50,558 p=517284 u=joel-livingstone-kofi-ackah n=ansible INFO| TASK [ping] **************************************************************************************************************************************************************
2026-01-20 14:16:56,450 p=517284 u=joel-livingstone-kofi-ackah n=ansible INFO| ok: [webapp]
2026-01-20 14:16:56,451 p=517284 u=joel-livingstone-kofi-ackah n=ansible INFO| PLAY RECAP ***************************************************************************************************************************************************************
2026-01-20 14:16:56,451 p=517284 u=joel-livingstone-kofi-ackah n=ansible INFO| webapp                     : ok=1    changed=0    unreachable=0    failed=0    skipped=0    rescued=0    ignored=0   
2026-01-20 14:22:50,477 p=519952 u=joel-livingstone-kofi-ackah n=ansible INFO| webapp | SUCCESS => {
    "changed": false,
    "ping": "pong"
}
2026-01-21 10:25:33,338 p=676073 u=joel-livingstone-kofi-ackah n=ansible INFO| webapp | SUCCESS => {
    "changed": false,
    "ping": "pong"
}
2026-01-21 10:25:36,500 p=676224 u=joel-livingstone-kofi-ackah n=ansible INFO| PLAY [Test Connection to Web Server] *************************************************************************************************************************************
2026-01-21 10:25:36,507 p=676224 u=joel-livingstone-kofi-ackah n=ansible INFO| TASK [Gathering Facts] ***************************************************************************************************************************************************
2026-01-21 10:25:42,474 p=676224 u=joel-livingstone-kofi-ackah n=ansible INFO| ok: [webapp]
2026-01-21 10:25:42,480 p=676224 u=joel-livingstone-kofi-ackah n=ansible INFO| TASK [Ping the server] ***************************************************************************************************************************************************
2026-01-21 10:25:46,763 p=676224 u=joel-livingstone-kofi-ackah n=ansible INFO| ok: [webapp]
2026-01-21 10:25:46,785 p=676224 u=joel-livingstone-kofi-ackah n=ansible INFO| TASK [Display server information] ****************************************************************************************************************************************
2026-01-21 10:25:46,816 p=676224 u=joel-livingstone-kofi-ackah n=ansible INFO| ok: [webapp] => {
    "msg": "Hostname: ip-10-0-1-210\nOS: Amazon 2023\nIP Address: 10.0.1.210\n"
}
2026-01-21 10:25:46,821 p=676224 u=joel-livingstone-kofi-ackah n=ansible INFO| TASK [Check if Nginx is installed] ***************************************************************************************************************************************
2026-01-21 10:25:50,746 p=676224 u=joel-livingstone-kofi-ackah n=ansible INFO| ok: [webapp]
2026-01-21 10:25:50,762 p=676224 u=joel-livingstone-kofi-ackah n=ansible INFO| TASK [Display Nginx status] **********************************************************************************************************************************************
2026-01-21 10:25:50,792 p=676224 u=joel-livingstone-kofi-ackah n=ansible INFO| ok: [webapp] => {
    "msg": "Nginx is not installed"
}
2026-01-21 10:25:50,793 p=676224 u=joel-livingstone-kofi-ackah n=ansible INFO| PLAY RECAP ***************************************************************************************************************************************************************
2026-01-21 10:25:50,793 p=676224 u=joel-livingstone-kofi-ackah n=ansible INFO| webapp                     : ok=5    changed=0    unreachable=0    failed=0    skipped=0    rescued=0    ignored=0   
2026-01-21 10:26:09,412 p=676643 u=joel-livingstone-kofi-ackah n=ansible INFO| PLAY [Test Connection to Web Server] *************************************************************************************************************************************
2026-01-21 10:26:09,418 p=676643 u=joel-livingstone-kofi-ackah n=ansible INFO| TASK [Gathering Facts] ***************************************************************************************************************************************************
2026-01-21 10:26:14,221 p=676643 u=joel-livingstone-kofi-ackah n=ansible INFO| ok: [webapp]
2026-01-21 10:26:14,226 p=676643 u=joel-livingstone-kofi-ackah n=ansible INFO| TASK [Ping the server] ***************************************************************************************************************************************************
2026-01-21 10:26:17,878 p=676643 u=joel-livingstone-kofi-ackah n=ansible INFO| ok: [webapp]
2026-01-21 10:26:17,894 p=676643 u=joel-livingstone-kofi-ackah n=ansible INFO| TASK [Display server information] ****************************************************************************************************************************************
2026-01-21 10:26:17,925 p=676643 u=joel-livingstone-kofi-ackah n=ansible INFO| ok: [webapp] => {
    "msg": "Hostname: ip-10-0-1-210\nOS: Amazon 2023\nIP Address: 10.0.1.210\n"
}
2026-01-21 10:26:17,928 p=676643 u=joel-livingstone-kofi-ackah n=ansible INFO| TASK [Check if Nginx is installed] ***************************************************************************************************************************************
2026-01-21 10:26:21,675 p=676643 u=joel-livingstone-kofi-ackah n=ansible INFO| ok: [webapp]
2026-01-21 10:26:21,683 p=676643 u=joel-livingstone-kofi-ackah n=ansible INFO| TASK [Display Nginx status] **********************************************************************************************************************************************
2026-01-21 10:26:21,705 p=676643 u=joel-livingstone-kofi-ackah n=ansible INFO| ok: [webapp] => {
    "msg": "Nginx is not installed"
}
2026-01-21 10:26:21,706 p=676643 u=joel-livingstone-kofi-ackah n=ansible INFO| PLAY RECAP ***************************************************************************************************************************************************************
2026-01-21 10:26:21,707 p=676643 u=joel-livingstone-kofi-ackah n=ansible INFO| webapp                     : ok=5    changed=0    unreachable=0    failed=0    skipped=0    rescued=0    ignored=0   
2026-01-21 10:42:19,846 p=682898 u=joel-livingstone-kofi-ackah n=ansible INFO| PLAY [Install and Start Nginx] *******************************************************************************************************************************************
2026-01-21 10:42:19,852 p=682898 u=joel-livingstone-kofi-ackah n=ansible INFO| TASK [Gathering Facts] ***************************************************************************************************************************************************
2026-01-21 10:42:26,922 p=682898 u=joel-livingstone-kofi-ackah n=ansible INFO| ok: [webapp]
2026-01-21 10:42:26,928 p=682898 u=joel-livingstone-kofi-ackah n=ansible INFO| TASK [Display target host information] ***********************************************************************************************************************************
2026-01-21 10:42:26,952 p=682898 u=joel-livingstone-kofi-ackah n=ansible INFO| ok: [webapp] => {
    "msg": "Starting Nginx setup on 3.254.177.169"
}
2026-01-21 10:42:26,970 p=682898 u=joel-livingstone-kofi-ackah n=ansible INFO| TASK [Ensure Nginx is installed] *****************************************************************************************************************************************
2026-01-21 10:42:45,018 p=682898 u=joel-livingstone-kofi-ackah n=ansible INFO| changed: [webapp]
2026-01-21 10:42:45,033 p=682898 u=joel-livingstone-kofi-ackah n=ansible INFO| TASK [Debug Nginx installation status] ***********************************************************************************************************************************
2026-01-21 10:42:45,059 p=682898 u=joel-livingstone-kofi-ackah n=ansible INFO| ok: [webapp] => {
    "nginx_install_result.changed": true
}
2026-01-21 10:42:45,062 p=682898 u=joel-livingstone-kofi-ackah n=ansible INFO| TASK [Create simple welcome page] ****************************************************************************************************************************************
2026-01-21 10:42:55,333 p=682898 u=joel-livingstone-kofi-ackah n=ansible INFO| changed: [webapp]
2026-01-21 10:42:55,360 p=682898 u=joel-livingstone-kofi-ackah n=ansible INFO| TASK [Start Nginx service] ***********************************************************************************************************************************************
2026-01-21 10:43:00,456 p=682898 u=joel-livingstone-kofi-ackah n=ansible INFO| changed: [webapp]
2026-01-21 10:43:00,476 p=682898 u=joel-livingstone-kofi-ackah n=ansible INFO| RUNNING HANDLER [Restart Nginx] ******************************************************************************************************************************************
2026-01-21 10:43:05,614 p=682898 u=joel-livingstone-kofi-ackah n=ansible INFO| changed: [webapp]
2026-01-21 10:43:05,615 p=682898 u=joel-livingstone-kofi-ackah n=ansible INFO| PLAY RECAP ***************************************************************************************************************************************************************
2026-01-21 10:43:05,615 p=682898 u=joel-livingstone-kofi-ackah n=ansible INFO| webapp                     : ok=7    changed=4    unreachable=0    failed=0    skipped=0    rescued=0    ignored=0   
2026-01-21 17:57:16,255 p=856550 u=joel-livingstone-kofi-ackah n=ansible INFO| PLAY [Deploy Node.js Todo App with MongoDB and Nginx] ********************************************************************************************************************
2026-01-21 17:57:16,267 p=856550 u=joel-livingstone-kofi-ackah n=ansible INFO| TASK [Gathering Facts] ***************************************************************************************************************************************************
2026-01-21 17:57:24,817 p=856550 u=joel-livingstone-kofi-ackah n=ansible INFO| ok: [webapp]
2026-01-21 17:57:24,837 p=856550 u=joel-livingstone-kofi-ackah n=ansible INFO| TASK [Display deployment information] ************************************************************************************************************************************
2026-01-21 17:57:24,935 p=856550 u=joel-livingstone-kofi-ackah n=ansible INFO| ok: [webapp] => {
    "msg": "Deploying Todo App to 3.254.177.169\nRepository: https://github.com/KofiAckah/Deploy_n_Configure-Web_App.git\nApp Directory: /var/www/todoapp\n"
}
2026-01-21 17:57:24,952 p=856550 u=joel-livingstone-kofi-ackah n=ansible INFO| TASK [Update system packages] ********************************************************************************************************************************************
2026-01-21 17:57:30,521 p=856550 u=joel-livingstone-kofi-ackah n=ansible INFO| ok: [webapp]
2026-01-21 17:57:30,549 p=856550 u=joel-livingstone-kofi-ackah n=ansible INFO| TASK [Add MongoDB repository] ********************************************************************************************************************************************
2026-01-21 17:57:40,862 p=856550 u=joel-livingstone-kofi-ackah n=ansible INFO| changed: [webapp]
2026-01-21 17:57:40,877 p=856550 u=joel-livingstone-kofi-ackah n=ansible INFO| TASK [Install MongoDB] ***************************************************************************************************************************************************
2026-01-21 17:58:02,039 p=856550 u=joel-livingstone-kofi-ackah n=ansible INFO| changed: [webapp]
2026-01-21 17:58:02,059 p=856550 u=joel-livingstone-kofi-ackah n=ansible INFO| TASK [Start and enable MongoDB service] **********************************************************************************************************************************
2026-01-21 17:58:07,595 p=856550 u=joel-livingstone-kofi-ackah n=ansible INFO| changed: [webapp]
2026-01-21 17:58:07,615 p=856550 u=joel-livingstone-kofi-ackah n=ansible INFO| TASK [Wait for MongoDB to be ready] **************************************************************************************************************************************
2026-01-21 17:58:18,032 p=856550 u=joel-livingstone-kofi-ackah n=ansible INFO| ok: [webapp]
2026-01-21 17:58:18,049 p=856550 u=joel-livingstone-kofi-ackah n=ansible INFO| TASK [Install Node.js repository (NodeSource)] ***************************************************************************************************************************
2026-01-21 17:58:24,315 p=856550 u=joel-livingstone-kofi-ackah n=ansible INFO| changed: [webapp]
2026-01-21 17:58:24,331 p=856550 u=joel-livingstone-kofi-ackah n=ansible INFO| TASK [Install Node.js and npm] *******************************************************************************************************************************************
2026-01-21 17:58:33,088 p=856550 u=joel-livingstone-kofi-ackah n=ansible INFO| changed: [webapp]
2026-01-21 17:58:33,102 p=856550 u=joel-livingstone-kofi-ackah n=ansible INFO| TASK [Verify Node.js installation] ***************************************************************************************************************************************
2026-01-21 17:58:37,222 p=856550 u=joel-livingstone-kofi-ackah n=ansible INFO| ok: [webapp]
2026-01-21 17:58:37,236 p=856550 u=joel-livingstone-kofi-ackah n=ansible INFO| TASK [Display Node.js version] *******************************************************************************************************************************************
2026-01-21 17:58:37,323 p=856550 u=joel-livingstone-kofi-ackah n=ansible INFO| ok: [webapp] => {
    "msg": "Node.js version: v20.20.0"
}
2026-01-21 17:58:37,339 p=856550 u=joel-livingstone-kofi-ackah n=ansible INFO| TASK [Install Git] *******************************************************************************************************************************************************
2026-01-21 17:58:43,941 p=856550 u=joel-livingstone-kofi-ackah n=ansible INFO| changed: [webapp]
2026-01-21 17:58:43,958 p=856550 u=joel-livingstone-kofi-ackah n=ansible INFO| TASK [Create application directory] **************************************************************************************************************************************
2026-01-21 17:58:48,443 p=856550 u=joel-livingstone-kofi-ackah n=ansible INFO| changed: [webapp]
2026-01-21 17:58:48,459 p=856550 u=joel-livingstone-kofi-ackah n=ansible INFO| TASK [Clone application from GitHub] *************************************************************************************************************************************
2026-01-21 17:58:54,286 p=856550 u=joel-livingstone-kofi-ackah n=ansible INFO| changed: [webapp]
2026-01-21 17:58:54,301 p=856550 u=joel-livingstone-kofi-ackah n=ansible INFO| TASK [Navigate to webapp folder] *****************************************************************************************************************************************
2026-01-21 17:58:58,587 p=856550 u=joel-livingstone-kofi-ackah n=ansible INFO| ok: [webapp]
2026-01-21 17:58:58,604 p=856550 u=joel-livingstone-kofi-ackah n=ansible INFO| TASK [Display webapp contents] *******************************************************************************************************************************************
2026-01-21 17:58:58,676 p=856550 u=joel-livingstone-kofi-ackah n=ansible INFO| ok: [webapp] => {
    "msg": [
        "total 76",
        "drwxrwxr-x. 6 ec2-user ec2-user   178 Jan 21 17:58 .",
        "drwxr-xr-x. 6 ec2-user ec2-user    82 Jan 21 17:58 ..",
        "-rw-rw-r--. 1 ec2-user ec2-user   140 Jan 21 17:58 .env.example",
        "-rw-rw-r--. 1 ec2-user ec2-user    35 Jan 21 17:58 .gitignore",
        "-rw-rw-r--. 1 ec2-user ec2-user  3624 Jan 21 17:58 README.md",
        "drwxrwxr-x. 2 ec2-user ec2-user    21 Jan 21 17:58 models",
        "-rw-rw-r--. 1 ec2-user ec2-user 54768 Jan 21 17:58 package-lock.json",
        "-rw-rw-r--. 1 ec2-user ec2-user   548 Jan 21 17:58 package.json",
        "drwxrwxr-x. 4 ec2-user ec2-user    27 Jan 21 17:58 public",
        "drwxrwxr-x. 2 ec2-user ec2-user    22 Jan 21 17:58 routes",
        "-rw-rw-r--. 1 ec2-user ec2-user  1437 Jan 21 17:58 server.js",
        "drwxrwxr-x. 2 ec2-user ec2-user    23 Jan 21 17:58 views"
    ]
}
2026-01-21 17:58:58,692 p=856550 u=joel-livingstone-kofi-ackah n=ansible INFO| TASK [Install npm dependencies] ******************************************************************************************************************************************
2026-01-21 17:59:06,261 p=856550 u=joel-livingstone-kofi-ackah n=ansible INFO| changed: [webapp]
2026-01-21 17:59:06,274 p=856550 u=joel-livingstone-kofi-ackah n=ansible INFO| TASK [Create .env file for production] ***********************************************************************************************************************************
2026-01-21 17:59:15,169 p=856550 u=joel-livingstone-kofi-ackah n=ansible INFO| changed: [webapp]
2026-01-21 17:59:15,179 p=856550 u=joel-livingstone-kofi-ackah n=ansible INFO| TASK [Create systemd service file for Node.js app] ***********************************************************************************************************************
2026-01-21 17:59:24,321 p=856550 u=joel-livingstone-kofi-ackah n=ansible INFO| changed: [webapp]
2026-01-21 17:59:24,334 p=856550 u=joel-livingstone-kofi-ackah n=ansible INFO| TASK [Reload systemd daemon] *********************************************************************************************************************************************
2026-01-21 17:59:28,885 p=856550 u=joel-livingstone-kofi-ackah n=ansible INFO| ok: [webapp]
2026-01-21 17:59:28,890 p=856550 u=joel-livingstone-kofi-ackah n=ansible INFO| TASK [Start and enable Todo App service] *********************************************************************************************************************************
2026-01-21 17:59:33,406 p=856550 u=joel-livingstone-kofi-ackah n=ansible INFO| changed: [webapp]
2026-01-21 17:59:33,423 p=856550 u=joel-livingstone-kofi-ackah n=ansible INFO| TASK [Wait for Node.js app to start] *************************************************************************************************************************************
2026-01-21 17:59:40,541 p=856550 u=joel-livingstone-kofi-ackah n=ansible INFO| ok: [webapp]
2026-01-21 17:59:40,557 p=856550 u=joel-livingstone-kofi-ackah n=ansible INFO| TASK [Install Nginx] *****************************************************************************************************************************************************
2026-01-21 17:59:44,990 p=856550 u=joel-livingstone-kofi-ackah n=ansible INFO| ok: [webapp]
2026-01-21 17:59:45,012 p=856550 u=joel-livingstone-kofi-ackah n=ansible INFO| TASK [Configure Nginx as reverse proxy] **********************************************************************************************************************************
2026-01-21 17:59:53,142 p=856550 u=joel-livingstone-kofi-ackah n=ansible INFO| changed: [webapp]
2026-01-21 17:59:53,156 p=856550 u=joel-livingstone-kofi-ackah n=ansible INFO| TASK [Remove default Nginx configuration] ********************************************************************************************************************************
2026-01-21 17:59:56,722 p=856550 u=joel-livingstone-kofi-ackah n=ansible INFO| changed: [webapp]
2026-01-21 17:59:56,737 p=856550 u=joel-livingstone-kofi-ackah n=ansible INFO| TASK [Test Nginx configuration] ******************************************************************************************************************************************
2026-01-21 18:00:00,135 p=856550 u=joel-livingstone-kofi-ackah n=ansible INFO| ok: [webapp]
2026-01-21 18:00:00,152 p=856550 u=joel-livingstone-kofi-ackah n=ansible INFO| TASK [Display Nginx test results] ****************************************************************************************************************************************
2026-01-21 18:00:00,234 p=856550 u=joel-livingstone-kofi-ackah n=ansible INFO| ok: [webapp] => {
    "msg": [
        "nginx: the configuration file /etc/nginx/nginx.conf syntax is ok",
        "nginx: configuration file /etc/nginx/nginx.conf test is successful"
    ]
}
2026-01-21 18:00:00,250 p=856550 u=joel-livingstone-kofi-ackah n=ansible INFO| TASK [Start and enable Nginx] ********************************************************************************************************************************************
2026-01-21 18:00:04,335 p=856550 u=joel-livingstone-kofi-ackah n=ansible INFO| ok: [webapp]
2026-01-21 18:00:04,357 p=856550 u=joel-livingstone-kofi-ackah n=ansible INFO| TASK [Check if Todo App is responding] ***********************************************************************************************************************************
2026-01-21 18:00:08,661 p=856550 u=joel-livingstone-kofi-ackah n=ansible INFO| ok: [webapp]
2026-01-21 18:00:08,674 p=856550 u=joel-livingstone-kofi-ackah n=ansible INFO| TASK [Display application health status] *********************************************************************************************************************************
2026-01-21 18:00:08,796 p=856550 u=joel-livingstone-kofi-ackah n=ansible INFO| ok: [webapp] => {
    "msg": "Application Status: OK"
}
2026-01-21 18:00:08,810 p=856550 u=joel-livingstone-kofi-ackah n=ansible INFO| TASK [Display deployment summary] ****************************************************************************************************************************************
2026-01-21 18:00:08,911 p=856550 u=joel-livingstone-kofi-ackah n=ansible INFO| ok: [webapp] => {
    "msg": "✅ DEPLOYMENT SUCCESSFUL!\n━━━━━━━━━━━━━━━━━━━━━━━━━━━━━━━━━━━━━━━━\n📦 Application: Todo App\n Access URL: http://10.0.1.210\n🔗 Health Check: http://10.0.1.210/health\n App Directory: /var/www/todoapp/webapp\n🗄️  Database: MongoDB running on port 27017\n🚀 Node.js App: Running on port 3000\n🔄 Nginx: Reverse proxy configured\n📊 Service: systemctl status todoapp\n📋 Logs: journalctl -u todoapp -f\n"
}
2026-01-21 18:00:08,943 p=856550 u=joel-livingstone-kofi-ackah n=ansible INFO| RUNNING HANDLER [Restart Nginx] ******************************************************************************************************************************************
2026-01-21 18:00:13,541 p=856550 u=joel-livingstone-kofi-ackah n=ansible INFO| changed: [webapp]
2026-01-21 18:00:13,544 p=856550 u=joel-livingstone-kofi-ackah n=ansible INFO| PLAY RECAP ***************************************************************************************************************************************************************
2026-01-21 18:00:13,544 p=856550 u=joel-livingstone-kofi-ackah n=ansible INFO| webapp                     : ok=32   changed=15   unreachable=0    failed=0    skipped=0    rescued=0    ignored=0   
2026-01-23 11:52:32,137 p=1169191 u=joel-livingstone-kofi-ackah n=ansible INFO| PLAY [Test Connection to Web Server] ***********************************************************************************************************************************
2026-01-23 11:52:32,148 p=1169191 u=joel-livingstone-kofi-ackah n=ansible INFO| TASK [Gathering Facts] *************************************************************************************************************************************************
2026-01-23 11:52:33,366 p=1169191 u=joel-livingstone-kofi-ackah n=ansible ERROR| [ERROR]: Task failed: Failed to connect to the host via ssh: Warning: Permanently added '52.31.139.173' (ED25519) to the list of known hosts.
no such identity: Compute/AnsibleKeyPair.pem: No such file or directory
ec2-user@52.31.139.173: Permission denied (publickey,gssapi-keyex,gssapi-with-mic).


2026-01-23 11:52:33,366 p=1169191 u=joel-livingstone-kofi-ackah n=ansible INFO| fatal: [webapp]: UNREACHABLE! => {"changed": false, "msg": "Task failed: Failed to connect to the host via ssh: Warning: Permanently added '52.31.139.173' (ED25519) to the list of known hosts.\r\nno such identity: Compute/AnsibleKeyPair.pem: No such file or directory\r\nec2-user@52.31.139.173: Permission denied (publickey,gssapi-keyex,gssapi-with-mic).", "unreachable": true}
2026-01-23 11:52:33,367 p=1169191 u=joel-livingstone-kofi-ackah n=ansible INFO| PLAY RECAP *************************************************************************************************************************************************************
2026-01-23 11:52:33,368 p=1169191 u=joel-livingstone-kofi-ackah n=ansible INFO| webapp                     : ok=0    changed=0    unreachable=1    failed=0    skipped=0    rescued=0    ignored=0   
2026-01-23 11:53:43,527 p=1170089 u=joel-livingstone-kofi-ackah n=ansible INFO| PLAY [Test Connection to Web Server] ***********************************************************************************************************************************
2026-01-23 11:53:43,535 p=1170089 u=joel-livingstone-kofi-ackah n=ansible INFO| TASK [Gathering Facts] *************************************************************************************************************************************************
2026-01-23 11:53:49,906 p=1170089 u=joel-livingstone-kofi-ackah n=ansible INFO| ok: [webapp]
2026-01-23 11:53:49,922 p=1170089 u=joel-livingstone-kofi-ackah n=ansible INFO| TASK [Ping the server] *************************************************************************************************************************************************
2026-01-23 11:53:53,309 p=1170089 u=joel-livingstone-kofi-ackah n=ansible INFO| ok: [webapp]
2026-01-23 11:53:53,336 p=1170089 u=joel-livingstone-kofi-ackah n=ansible INFO| TASK [Display server information] **************************************************************************************************************************************
2026-01-23 11:53:53,403 p=1170089 u=joel-livingstone-kofi-ackah n=ansible INFO| ok: [webapp] => {
    "msg": "Hostname: ip-10-0-1-225\nOS: Amazon 2023\nIP Address: 10.0.1.225\n"
}
2026-01-23 11:53:53,404 p=1170089 u=joel-livingstone-kofi-ackah n=ansible INFO| PLAY RECAP *************************************************************************************************************************************************************
2026-01-23 11:53:53,404 p=1170089 u=joel-livingstone-kofi-ackah n=ansible INFO| webapp                     : ok=3    changed=0    unreachable=0    failed=0    skipped=0    rescued=0    ignored=0   
2026-01-23 11:54:15,543 p=1170485 u=joel-livingstone-kofi-ackah n=ansible INFO| PLAY [Deploy Node.js Todo App with MongoDB and Nginx] ******************************************************************************************************************
2026-01-23 11:54:15,550 p=1170485 u=joel-livingstone-kofi-ackah n=ansible INFO| TASK [Gathering Facts] *************************************************************************************************************************************************
2026-01-23 11:54:20,802 p=1170485 u=joel-livingstone-kofi-ackah n=ansible INFO| ok: [webapp]
2026-01-23 11:54:20,819 p=1170485 u=joel-livingstone-kofi-ackah n=ansible INFO| TASK [Display deployment information] **********************************************************************************************************************************
2026-01-23 11:54:20,907 p=1170485 u=joel-livingstone-kofi-ackah n=ansible INFO| ok: [webapp] => {
    "msg": "Deploying Todo App to 52.31.139.173\nRepository: https://github.com/KofiAckah/Deploy_n_Configure-Web_App.git\nApp Directory: /var/www/todoapp\n"
}
2026-01-23 11:54:20,923 p=1170485 u=joel-livingstone-kofi-ackah n=ansible INFO| TASK [Update system packages] ******************************************************************************************************************************************
2026-01-23 11:54:36,973 p=1170485 u=joel-livingstone-kofi-ackah n=ansible INFO| ok: [webapp]
2026-01-23 11:54:36,998 p=1170485 u=joel-livingstone-kofi-ackah n=ansible INFO| TASK [Add MongoDB repository] ******************************************************************************************************************************************
2026-01-23 11:54:45,544 p=1170485 u=joel-livingstone-kofi-ackah n=ansible INFO| changed: [webapp]
2026-01-23 11:54:45,562 p=1170485 u=joel-livingstone-kofi-ackah n=ansible INFO| TASK [Install MongoDB] *************************************************************************************************************************************************
2026-01-23 11:55:08,169 p=1170485 u=joel-livingstone-kofi-ackah n=ansible INFO| changed: [webapp]
2026-01-23 11:55:08,186 p=1170485 u=joel-livingstone-kofi-ackah n=ansible INFO| TASK [Start and enable MongoDB service] ********************************************************************************************************************************
2026-01-23 11:55:12,876 p=1170485 u=joel-livingstone-kofi-ackah n=ansible INFO| changed: [webapp]
2026-01-23 11:55:12,890 p=1170485 u=joel-livingstone-kofi-ackah n=ansible INFO| TASK [Wait for MongoDB to be ready] ************************************************************************************************************************************
2026-01-23 11:55:21,525 p=1170485 u=joel-livingstone-kofi-ackah n=ansible INFO| ok: [webapp]
2026-01-23 11:55:21,543 p=1170485 u=joel-livingstone-kofi-ackah n=ansible INFO| TASK [Install Node.js repository (NodeSource)] *************************************************************************************************************************
2026-01-23 11:55:27,329 p=1170485 u=joel-livingstone-kofi-ackah n=ansible INFO| changed: [webapp]
2026-01-23 11:55:27,346 p=1170485 u=joel-livingstone-kofi-ackah n=ansible INFO| TASK [Install Node.js and npm] *****************************************************************************************************************************************
2026-01-23 11:55:40,021 p=1170485 u=joel-livingstone-kofi-ackah n=ansible INFO| changed: [webapp]
2026-01-23 11:55:40,037 p=1170485 u=joel-livingstone-kofi-ackah n=ansible INFO| TASK [Verify Node.js installation] *************************************************************************************************************************************
2026-01-23 11:55:44,608 p=1170485 u=joel-livingstone-kofi-ackah n=ansible INFO| ok: [webapp]
2026-01-23 11:55:44,624 p=1170485 u=joel-livingstone-kofi-ackah n=ansible INFO| TASK [Display Node.js version] *****************************************************************************************************************************************
2026-01-23 11:55:44,694 p=1170485 u=joel-livingstone-kofi-ackah n=ansible INFO| ok: [webapp] => {
    "msg": "Node.js version: v20.20.0"
}
2026-01-23 11:55:44,702 p=1170485 u=joel-livingstone-kofi-ackah n=ansible INFO| TASK [Install Git] *****************************************************************************************************************************************************
2026-01-23 11:55:53,063 p=1170485 u=joel-livingstone-kofi-ackah n=ansible INFO| changed: [webapp]
2026-01-23 11:55:53,080 p=1170485 u=joel-livingstone-kofi-ackah n=ansible INFO| TASK [Create application directory] ************************************************************************************************************************************
2026-01-23 11:55:57,529 p=1170485 u=joel-livingstone-kofi-ackah n=ansible INFO| changed: [webapp]
2026-01-23 11:55:57,536 p=1170485 u=joel-livingstone-kofi-ackah n=ansible INFO| TASK [Clone application from GitHub] ***********************************************************************************************************************************
2026-01-23 11:56:02,359 p=1170485 u=joel-livingstone-kofi-ackah n=ansible INFO| changed: [webapp]
2026-01-23 11:56:02,366 p=1170485 u=joel-livingstone-kofi-ackah n=ansible INFO| TASK [Navigate to webapp folder] ***************************************************************************************************************************************
2026-01-23 11:56:06,663 p=1170485 u=joel-livingstone-kofi-ackah n=ansible INFO| ok: [webapp]
2026-01-23 11:56:06,680 p=1170485 u=joel-livingstone-kofi-ackah n=ansible INFO| TASK [Display webapp contents] *****************************************************************************************************************************************
2026-01-23 11:56:06,747 p=1170485 u=joel-livingstone-kofi-ackah n=ansible INFO| ok: [webapp] => {
    "msg": [
        "total 76",
        "drwxrwxr-x. 6 ec2-user ec2-user   178 Jan 23 11:56 .",
        "drwxr-xr-x. 6 ec2-user ec2-user    82 Jan 23 11:56 ..",
        "-rw-rw-r--. 1 ec2-user ec2-user   140 Jan 23 11:56 .env.example",
        "-rw-rw-r--. 1 ec2-user ec2-user    35 Jan 23 11:56 .gitignore",
        "-rw-rw-r--. 1 ec2-user ec2-user  3624 Jan 23 11:56 README.md",
        "drwxrwxr-x. 2 ec2-user ec2-user    21 Jan 23 11:56 models",
        "-rw-rw-r--. 1 ec2-user ec2-user 54768 Jan 23 11:56 package-lock.json",
        "-rw-rw-r--. 1 ec2-user ec2-user   548 Jan 23 11:56 package.json",
        "drwxrwxr-x. 4 ec2-user ec2-user    27 Jan 23 11:56 public",
        "drwxrwxr-x. 2 ec2-user ec2-user    22 Jan 23 11:56 routes",
        "-rw-rw-r--. 1 ec2-user ec2-user  1437 Jan 23 11:56 server.js",
        "drwxrwxr-x. 2 ec2-user ec2-user    23 Jan 23 11:56 views"
    ]
}
2026-01-23 11:56:06,753 p=1170485 u=joel-livingstone-kofi-ackah n=ansible INFO| TASK [Install npm dependencies] ****************************************************************************************************************************************
2026-01-23 11:56:13,731 p=1170485 u=joel-livingstone-kofi-ackah n=ansible INFO| changed: [webapp]
2026-01-23 11:56:13,750 p=1170485 u=joel-livingstone-kofi-ackah n=ansible INFO| TASK [Create .env file for production] *********************************************************************************************************************************
2026-01-23 11:56:22,400 p=1170485 u=joel-livingstone-kofi-ackah n=ansible INFO| changed: [webapp]
2026-01-23 11:56:22,414 p=1170485 u=joel-livingstone-kofi-ackah n=ansible INFO| TASK [Create systemd service file for Node.js app] *********************************************************************************************************************
2026-01-23 11:56:30,940 p=1170485 u=joel-livingstone-kofi-ackah n=ansible INFO| changed: [webapp]
2026-01-23 11:56:30,959 p=1170485 u=joel-livingstone-kofi-ackah n=ansible INFO| TASK [Reload systemd daemon] *******************************************************************************************************************************************
2026-01-23 11:56:35,620 p=1170485 u=joel-livingstone-kofi-ackah n=ansible INFO| ok: [webapp]
2026-01-23 11:56:35,639 p=1170485 u=joel-livingstone-kofi-ackah n=ansible INFO| TASK [Start and enable Todo App service] *******************************************************************************************************************************
2026-01-23 11:56:40,357 p=1170485 u=joel-livingstone-kofi-ackah n=ansible INFO| changed: [webapp]
2026-01-23 11:56:40,368 p=1170485 u=joel-livingstone-kofi-ackah n=ansible INFO| TASK [Wait for Node.js app to start] ***********************************************************************************************************************************
2026-01-23 11:56:47,627 p=1170485 u=joel-livingstone-kofi-ackah n=ansible INFO| ok: [webapp]
2026-01-23 11:56:47,642 p=1170485 u=joel-livingstone-kofi-ackah n=ansible INFO| TASK [Install Nginx] ***************************************************************************************************************************************************
2026-01-23 11:56:54,076 p=1170485 u=joel-livingstone-kofi-ackah n=ansible INFO| changed: [webapp]
2026-01-23 11:56:54,085 p=1170485 u=joel-livingstone-kofi-ackah n=ansible INFO| TASK [Configure Nginx as reverse proxy] ********************************************************************************************************************************
2026-01-23 11:57:03,196 p=1170485 u=joel-livingstone-kofi-ackah n=ansible INFO| changed: [webapp]
2026-01-23 11:57:03,211 p=1170485 u=joel-livingstone-kofi-ackah n=ansible INFO| TASK [Remove default Nginx configuration] ******************************************************************************************************************************
2026-01-23 11:57:07,364 p=1170485 u=joel-livingstone-kofi-ackah n=ansible INFO| changed: [webapp]
2026-01-23 11:57:07,383 p=1170485 u=joel-livingstone-kofi-ackah n=ansible INFO| TASK [Test Nginx configuration] ****************************************************************************************************************************************
2026-01-23 11:57:11,074 p=1170485 u=joel-livingstone-kofi-ackah n=ansible INFO| ok: [webapp]
2026-01-23 11:57:11,088 p=1170485 u=joel-livingstone-kofi-ackah n=ansible INFO| TASK [Display Nginx test results] **************************************************************************************************************************************
2026-01-23 11:57:11,162 p=1170485 u=joel-livingstone-kofi-ackah n=ansible INFO| ok: [webapp] => {
    "msg": [
        "nginx: the configuration file /etc/nginx/nginx.conf syntax is ok",
        "nginx: configuration file /etc/nginx/nginx.conf test is successful"
    ]
}
2026-01-23 11:57:11,172 p=1170485 u=joel-livingstone-kofi-ackah n=ansible INFO| TASK [Start and enable Nginx] ******************************************************************************************************************************************
2026-01-23 11:57:15,311 p=1170485 u=joel-livingstone-kofi-ackah n=ansible INFO| changed: [webapp]
2026-01-23 11:57:15,335 p=1170485 u=joel-livingstone-kofi-ackah n=ansible INFO| TASK [Check if Todo App is responding] *********************************************************************************************************************************
2026-01-23 11:57:19,163 p=1170485 u=joel-livingstone-kofi-ackah n=ansible INFO| ok: [webapp]
2026-01-23 11:57:19,182 p=1170485 u=joel-livingstone-kofi-ackah n=ansible INFO| TASK [Display application health status] *******************************************************************************************************************************
2026-01-23 11:57:19,277 p=1170485 u=joel-livingstone-kofi-ackah n=ansible INFO| ok: [webapp] => {
    "msg": "Application Status: OK"
}
2026-01-23 11:57:19,281 p=1170485 u=joel-livingstone-kofi-ackah n=ansible INFO| TASK [Display deployment summary] **************************************************************************************************************************************
2026-01-23 11:57:19,306 p=1170485 u=joel-livingstone-kofi-ackah n=ansible INFO| ok: [webapp] => {
    "msg": "✅ DEPLOYMENT SUCCESSFUL!\n━━━━━━━━━━━━━━━━━━━━━━━━━━━━━━━━━━━━━━━━\n📦 Application: Todo App\n Access URL: http://10.0.1.225\n🔗 Health Check: http://10.0.1.225/health\n App Directory: /var/www/todoapp/webapp\n🗄️  Database: MongoDB running on port 27017\n🚀 Node.js App: Running on port 3000\n🔄 Nginx: Reverse proxy configured\n📊 Service: systemctl status todoapp\n📋 Logs: journalctl -u todoapp -f\n"
}
2026-01-23 11:57:19,317 p=1170485 u=joel-livingstone-kofi-ackah n=ansible INFO| RUNNING HANDLER [Restart Nginx] ****************************************************************************************************************************************
2026-01-23 11:57:23,472 p=1170485 u=joel-livingstone-kofi-ackah n=ansible INFO| changed: [webapp]
2026-01-23 11:57:23,476 p=1170485 u=joel-livingstone-kofi-ackah n=ansible INFO| PLAY RECAP *************************************************************************************************************************************************************
2026-01-23 11:57:23,477 p=1170485 u=joel-livingstone-kofi-ackah n=ansible INFO| webapp                     : ok=32   changed=17   unreachable=0    failed=0    skipped=0    rescued=0    ignored=0   
2026-01-28 11:42:46,289 p=349433 u=joel-livingstone-kofi-ackah n=ansible INFO| PLAY [Deploy Node.js Todo App with MongoDB and Nginx] *****************************************************************************************
2026-01-28 11:42:46,302 p=349433 u=joel-livingstone-kofi-ackah n=ansible INFO| TASK [Gathering Facts] ************************************************************************************************************************
2026-01-28 11:42:47,574 p=349433 u=joel-livingstone-kofi-ackah n=ansible ERROR| [ERROR]: Task failed: Failed to connect to the host via ssh: Warning: Permanently added '34.243.244.28' (ED25519) to the list of known hosts.
no such identity: ../Compute/AnsibleKeyPair.pem: No such file or directory
ec2-user@34.243.244.28: Permission denied (publickey,gssapi-keyex,gssapi-with-mic).


2026-01-28 11:42:47,575 p=349433 u=joel-livingstone-kofi-ackah n=ansible INFO| fatal: [webapp]: UNREACHABLE! => {"changed": false, "msg": "Task failed: Failed to connect to the host via ssh: Warning: Permanently added '34.243.244.28' (ED25519) to the list of known hosts.\r\nno such identity: ../Compute/AnsibleKeyPair.pem: No such file or directory\r\nec2-user@34.243.244.28: Permission denied (publickey,gssapi-keyex,gssapi-with-mic).", "unreachable": true}
2026-01-28 11:42:47,575 p=349433 u=joel-livingstone-kofi-ackah n=ansible INFO| PLAY RECAP ************************************************************************************************************************************
2026-01-28 11:42:47,576 p=349433 u=joel-livingstone-kofi-ackah n=ansible INFO| webapp                     : ok=0    changed=0    unreachable=1    failed=0    skipped=0    rescued=0    ignored=0   
2026-01-28 11:43:07,854 p=349924 u=joel-livingstone-kofi-ackah n=ansible INFO| PLAY [Test Connection to Web Server] **********************************************************************************************************
2026-01-28 11:43:07,861 p=349924 u=joel-livingstone-kofi-ackah n=ansible INFO| TASK [Gathering Facts] ************************************************************************************************************************
2026-01-28 11:43:09,090 p=349924 u=joel-livingstone-kofi-ackah n=ansible ERROR| [ERROR]: Task failed: Failed to connect to the host via ssh: no such identity: ../Compute/AnsibleKeyPair.pem: No such file or directory
ec2-user@34.243.244.28: Permission denied (publickey,gssapi-keyex,gssapi-with-mic).


2026-01-28 11:43:09,090 p=349924 u=joel-livingstone-kofi-ackah n=ansible INFO| fatal: [webapp]: UNREACHABLE! => {"changed": false, "msg": "Task failed: Failed to connect to the host via ssh: no such identity: ../Compute/AnsibleKeyPair.pem: No such file or directory\r\nec2-user@34.243.244.28: Permission denied (publickey,gssapi-keyex,gssapi-with-mic).", "unreachable": true}
2026-01-28 11:43:09,091 p=349924 u=joel-livingstone-kofi-ackah n=ansible INFO| PLAY RECAP ************************************************************************************************************************************
2026-01-28 11:43:09,091 p=349924 u=joel-livingstone-kofi-ackah n=ansible INFO| webapp                     : ok=0    changed=0    unreachable=1    failed=0    skipped=0    rescued=0    ignored=0   
2026-01-28 11:44:12,239 p=350411 u=joel-livingstone-kofi-ackah n=ansible INFO| PLAY [Test Connection to Web Server] **********************************************************************************************************
2026-01-28 11:44:12,247 p=350411 u=joel-livingstone-kofi-ackah n=ansible INFO| TASK [Gathering Facts] ************************************************************************************************************************
2026-01-28 11:44:13,479 p=350411 u=joel-livingstone-kofi-ackah n=ansible ERROR| [ERROR]: Task failed: Failed to connect to the host via ssh: no such identity: Terraform/Compute/AnsibleKeyPair.pem: No such file or directory
ec2-user@34.243.244.28: Permission denied (publickey,gssapi-keyex,gssapi-with-mic).


2026-01-28 11:44:13,479 p=350411 u=joel-livingstone-kofi-ackah n=ansible INFO| fatal: [webapp]: UNREACHABLE! => {"changed": false, "msg": "Task failed: Failed to connect to the host via ssh: no such identity: Terraform/Compute/AnsibleKeyPair.pem: No such file or directory\r\nec2-user@34.243.244.28: Permission denied (publickey,gssapi-keyex,gssapi-with-mic).", "unreachable": true}
2026-01-28 11:44:13,480 p=350411 u=joel-livingstone-kofi-ackah n=ansible INFO| PLAY RECAP ************************************************************************************************************************************
2026-01-28 11:44:13,480 p=350411 u=joel-livingstone-kofi-ackah n=ansible INFO| webapp                     : ok=0    changed=0    unreachable=1    failed=0    skipped=0    rescued=0    ignored=0   
2026-01-28 11:44:18,952 p=350495 u=joel-livingstone-kofi-ackah n=ansible INFO| PLAY [Test Connection to Web Server] **********************************************************************************************************
2026-01-28 11:44:18,962 p=350495 u=joel-livingstone-kofi-ackah n=ansible INFO| TASK [Gathering Facts] ************************************************************************************************************************
2026-01-28 11:44:20,071 p=350495 u=joel-livingstone-kofi-ackah n=ansible ERROR| [ERROR]: Task failed: Failed to connect to the host via ssh: no such identity: Terraform/Compute/AnsibleKeyPair.pem: No such file or directory
ec2-user@34.243.244.28: Permission denied (publickey,gssapi-keyex,gssapi-with-mic).


2026-01-28 11:44:20,071 p=350495 u=joel-livingstone-kofi-ackah n=ansible INFO| fatal: [webapp]: UNREACHABLE! => {"changed": false, "msg": "Task failed: Failed to connect to the host via ssh: no such identity: Terraform/Compute/AnsibleKeyPair.pem: No such file or directory\r\nec2-user@34.243.244.28: Permission denied (publickey,gssapi-keyex,gssapi-with-mic).", "unreachable": true}
2026-01-28 11:44:20,072 p=350495 u=joel-livingstone-kofi-ackah n=ansible INFO| PLAY RECAP ************************************************************************************************************************************
2026-01-28 11:44:20,072 p=350495 u=joel-livingstone-kofi-ackah n=ansible INFO| webapp                     : ok=0    changed=0    unreachable=1    failed=0    skipped=0    rescued=0    ignored=0   
2026-01-28 11:46:24,369 p=351619 u=joel-livingstone-kofi-ackah n=ansible INFO| PLAY [Test Connection to Web Server] **********************************************************************************************************
2026-01-28 11:46:24,376 p=351619 u=joel-livingstone-kofi-ackah n=ansible INFO| TASK [Gathering Facts] ************************************************************************************************************************
2026-01-28 11:46:25,648 p=351619 u=joel-livingstone-kofi-ackah n=ansible ERROR| [ERROR]: Task failed: Failed to connect to the host via ssh: no such identity: Terraform/Compute/AnsibleKeyPair.pem: No such file or directory
ec2-user@34.243.244.28: Permission denied (publickey,gssapi-keyex,gssapi-with-mic).


2026-01-28 11:46:25,649 p=351619 u=joel-livingstone-kofi-ackah n=ansible INFO| fatal: [webapp]: UNREACHABLE! => {"changed": false, "msg": "Task failed: Failed to connect to the host via ssh: no such identity: Terraform/Compute/AnsibleKeyPair.pem: No such file or directory\r\nec2-user@34.243.244.28: Permission denied (publickey,gssapi-keyex,gssapi-with-mic).", "unreachable": true}
2026-01-28 11:46:25,649 p=351619 u=joel-livingstone-kofi-ackah n=ansible INFO| PLAY RECAP ************************************************************************************************************************************
2026-01-28 11:46:25,649 p=351619 u=joel-livingstone-kofi-ackah n=ansible INFO| webapp                     : ok=0    changed=0    unreachable=1    failed=0    skipped=0    rescued=0    ignored=0   
2026-01-28 11:47:04,385 p=352011 u=joel-livingstone-kofi-ackah n=ansible INFO| PLAY [Test Connection to Web Server] **********************************************************************************************************
2026-01-28 11:47:04,392 p=352011 u=joel-livingstone-kofi-ackah n=ansible INFO| TASK [Gathering Facts] ************************************************************************************************************************
2026-01-28 11:47:05,505 p=352011 u=joel-livingstone-kofi-ackah n=ansible ERROR| [ERROR]: Task failed: Failed to connect to the host via ssh: no such identity: Terraform/Compute/AnsibleKeyPair.pem: No such file or directory
ec2-user@34.243.244.28: Permission denied (publickey,gssapi-keyex,gssapi-with-mic).


2026-01-28 11:47:05,505 p=352011 u=joel-livingstone-kofi-ackah n=ansible INFO| fatal: [webapp]: UNREACHABLE! => {"changed": false, "msg": "Task failed: Failed to connect to the host via ssh: no such identity: Terraform/Compute/AnsibleKeyPair.pem: No such file or directory\r\nec2-user@34.243.244.28: Permission denied (publickey,gssapi-keyex,gssapi-with-mic).", "unreachable": true}
2026-01-28 11:47:05,506 p=352011 u=joel-livingstone-kofi-ackah n=ansible INFO| PLAY RECAP ************************************************************************************************************************************
2026-01-28 11:47:05,506 p=352011 u=joel-livingstone-kofi-ackah n=ansible INFO| webapp                     : ok=0    changed=0    unreachable=1    failed=0    skipped=0    rescued=0    ignored=0   
2026-01-28 11:48:15,318 p=352598 u=joel-livingstone-kofi-ackah n=ansible INFO| PLAY [Test Connection to Web Server] **********************************************************************************************************
2026-01-28 11:48:15,325 p=352598 u=joel-livingstone-kofi-ackah n=ansible INFO| TASK [Gathering Facts] ************************************************************************************************************************
2026-01-28 11:48:16,517 p=352598 u=joel-livingstone-kofi-ackah n=ansible ERROR| [ERROR]: Task failed: Failed to connect to the host via ssh: @@@@@@@@@@@@@@@@@@@@@@@@@@@@@@@@@@@@@@@@@@@@@@@@@@@@@@@@@@@
@         WARNING: UNPROTECTED PRIVATE KEY FILE!          @
@@@@@@@@@@@@@@@@@@@@@@@@@@@@@@@@@@@@@@@@@@@@@@@@@@@@@@@@@@@
Permissions 0775 for '../Terraform/Compute/AnsibleKeyPair.pem' are too open.
It is required that your private key files are NOT accessible by others.
This private key will be ignored.
Load key "../Terraform/Compute/AnsibleKeyPair.pem": bad permissions
ec2-user@34.243.244.28: Permission denied (publickey,gssapi-keyex,gssapi-with-mic).


2026-01-28 11:48:16,518 p=352598 u=joel-livingstone-kofi-ackah n=ansible INFO| fatal: [webapp]: UNREACHABLE! => {"changed": false, "msg": "Task failed: Failed to connect to the host via ssh: @@@@@@@@@@@@@@@@@@@@@@@@@@@@@@@@@@@@@@@@@@@@@@@@@@@@@@@@@@@\r\n@         WARNING: UNPROTECTED PRIVATE KEY FILE!          @\r\n@@@@@@@@@@@@@@@@@@@@@@@@@@@@@@@@@@@@@@@@@@@@@@@@@@@@@@@@@@@\r\nPermissions 0775 for '../Terraform/Compute/AnsibleKeyPair.pem' are too open.\r\nIt is required that your private key files are NOT accessible by others.\r\nThis private key will be ignored.\r\nLoad key \"../Terraform/Compute/AnsibleKeyPair.pem\": bad permissions\r\nec2-user@34.243.244.28: Permission denied (publickey,gssapi-keyex,gssapi-with-mic).", "unreachable": true}
2026-01-28 11:48:16,518 p=352598 u=joel-livingstone-kofi-ackah n=ansible INFO| PLAY RECAP ************************************************************************************************************************************
2026-01-28 11:48:16,518 p=352598 u=joel-livingstone-kofi-ackah n=ansible INFO| webapp                     : ok=0    changed=0    unreachable=1    failed=0    skipped=0    rescued=0    ignored=0   
2026-01-28 11:49:49,574 p=353292 u=joel-livingstone-kofi-ackah n=ansible ERROR| [ERROR]: Task failed: Failed to connect to the host via ssh: no such identity: Terraform/Compute/AnsibleKeyPair.pem: No such file or directory
ec2-user@34.243.244.28: Permission denied (publickey,gssapi-keyex,gssapi-with-mic).
Origin: <adhoc 'ping' task>

{'action': 'ping', 'args': {}, 'timeout': 0, 'async_val': 0, 'poll': 15}


2026-01-28 11:49:49,575 p=353292 u=joel-livingstone-kofi-ackah n=ansible INFO| webapp | UNREACHABLE! => {
    "changed": false,
    "msg": "Task failed: Failed to connect to the host via ssh: no such identity: Terraform/Compute/AnsibleKeyPair.pem: No such file or directory\r\nec2-user@34.243.244.28: Permission denied (publickey,gssapi-keyex,gssapi-with-mic).",
    "unreachable": true
}
2026-01-28 11:51:44,262 p=354294 u=joel-livingstone-kofi-ackah n=ansible ERROR| [ERROR]: Task failed: Failed to connect to the host via ssh: @@@@@@@@@@@@@@@@@@@@@@@@@@@@@@@@@@@@@@@@@@@@@@@@@@@@@@@@@@@
@         WARNING: UNPROTECTED PRIVATE KEY FILE!          @
@@@@@@@@@@@@@@@@@@@@@@@@@@@@@@@@@@@@@@@@@@@@@@@@@@@@@@@@@@@
Permissions 0775 for '../Terraform/Compute/AnsibleKeyPair.pem' are too open.
It is required that your private key files are NOT accessible by others.
This private key will be ignored.
Load key "../Terraform/Compute/AnsibleKeyPair.pem": bad permissions
ec2-user@34.243.244.28: Permission denied (publickey,gssapi-keyex,gssapi-with-mic).
Origin: <adhoc 'ping' task>

{'action': 'ping', 'args': {}, 'timeout': 0, 'async_val': 0, 'poll': 15}


2026-01-28 11:51:44,262 p=354294 u=joel-livingstone-kofi-ackah n=ansible INFO| webapp | UNREACHABLE! => {
    "changed": false,
    "msg": "Task failed: Failed to connect to the host via ssh: @@@@@@@@@@@@@@@@@@@@@@@@@@@@@@@@@@@@@@@@@@@@@@@@@@@@@@@@@@@\r\n@         WARNING: UNPROTECTED PRIVATE KEY FILE!          @\r\n@@@@@@@@@@@@@@@@@@@@@@@@@@@@@@@@@@@@@@@@@@@@@@@@@@@@@@@@@@@\r\nPermissions 0775 for '../Terraform/Compute/AnsibleKeyPair.pem' are too open.\r\nIt is required that your private key files are NOT accessible by others.\r\nThis private key will be ignored.\r\nLoad key \"../Terraform/Compute/AnsibleKeyPair.pem\": bad permissions\r\nec2-user@34.243.244.28: Permission denied (publickey,gssapi-keyex,gssapi-with-mic).",
    "unreachable": true
}
2026-01-28 11:52:51,470 p=354939 u=joel-livingstone-kofi-ackah n=ansible ERROR| [ERROR]: Task failed: Failed to connect to the host via ssh: Load key "../Terraform/Compute/AnsibleKeyPair.pem": Permission denied
ec2-user@34.243.244.28: Permission denied (publickey,gssapi-keyex,gssapi-with-mic).
Origin: <adhoc 'ping' task>

{'action': 'ping', 'args': {}, 'timeout': 0, 'async_val': 0, 'poll': 15}


2026-01-28 11:52:51,470 p=354939 u=joel-livingstone-kofi-ackah n=ansible INFO| webapp | UNREACHABLE! => {
    "changed": false,
    "msg": "Task failed: Failed to connect to the host via ssh: Load key \"../Terraform/Compute/AnsibleKeyPair.pem\": Permission denied\r\nec2-user@34.243.244.28: Permission denied (publickey,gssapi-keyex,gssapi-with-mic).",
    "unreachable": true
}
2026-01-28 11:53:04,749 p=355109 u=joel-livingstone-kofi-ackah n=ansible ERROR| [ERROR]: Task failed: Failed to connect to the host via ssh: Load key "../Terraform/Compute/AnsibleKeyPair.pem": Permission denied
ec2-user@34.243.244.28: Permission denied (publickey,gssapi-keyex,gssapi-with-mic).
Origin: <adhoc 'ping' task>

{'action': 'ping', 'args': {}, 'timeout': 0, 'async_val': 0, 'poll': 15}


2026-01-28 11:53:04,749 p=355109 u=joel-livingstone-kofi-ackah n=ansible INFO| webapp | UNREACHABLE! => {
    "changed": false,
    "msg": "Task failed: Failed to connect to the host via ssh: Load key \"../Terraform/Compute/AnsibleKeyPair.pem\": Permission denied\r\nec2-user@34.243.244.28: Permission denied (publickey,gssapi-keyex,gssapi-with-mic).",
    "unreachable": true
}
2026-01-28 11:53:24,336 p=355298 u=joel-livingstone-kofi-ackah n=ansible ERROR| [ERROR]: Task failed: Failed to connect to the host via ssh: no such identity: Terraform/Compute/AnsibleKeyPair.pem: No such file or directory
ec2-user@34.243.244.28: Permission denied (publickey,gssapi-keyex,gssapi-with-mic).
Origin: <adhoc 'ping' task>

{'action': 'ping', 'args': {}, 'timeout': 0, 'async_val': 0, 'poll': 15}


2026-01-28 11:53:24,337 p=355298 u=joel-livingstone-kofi-ackah n=ansible INFO| webapp | UNREACHABLE! => {
    "changed": false,
    "msg": "Task failed: Failed to connect to the host via ssh: no such identity: Terraform/Compute/AnsibleKeyPair.pem: No such file or directory\r\nec2-user@34.243.244.28: Permission denied (publickey,gssapi-keyex,gssapi-with-mic).",
    "unreachable": true
}
2026-01-28 11:54:06,752 p=355660 u=joel-livingstone-kofi-ackah n=ansible ERROR| [ERROR]: Task failed: Failed to connect to the host via ssh: Load key "../Terraform/Compute/AnsibleKeyPair.pem": Permission denied
ec2-user@34.243.244.28: Permission denied (publickey,gssapi-keyex,gssapi-with-mic).
Origin: <adhoc 'ping' task>

{'action': 'ping', 'args': {}, 'timeout': 0, 'async_val': 0, 'poll': 15}


2026-01-28 11:54:06,752 p=355660 u=joel-livingstone-kofi-ackah n=ansible INFO| webapp | UNREACHABLE! => {
    "changed": false,
    "msg": "Task failed: Failed to connect to the host via ssh: Load key \"../Terraform/Compute/AnsibleKeyPair.pem\": Permission denied\r\nec2-user@34.243.244.28: Permission denied (publickey,gssapi-keyex,gssapi-with-mic).",
    "unreachable": true
}
2026-01-28 11:55:10,152 p=356178 u=joel-livingstone-kofi-ackah n=ansible INFO| webapp | SUCCESS => {
    "changed": false,
    "ping": "pong"
}
2026-01-28 11:55:20,492 p=356348 u=joel-livingstone-kofi-ackah n=ansible INFO| PLAY [Deploy Node.js Todo App with MongoDB and Nginx] *****************************************************************************************
2026-01-28 11:55:20,500 p=356348 u=joel-livingstone-kofi-ackah n=ansible INFO| TASK [Gathering Facts] ************************************************************************************************************************
2026-01-28 11:55:25,192 p=356348 u=joel-livingstone-kofi-ackah n=ansible INFO| ok: [webapp]
2026-01-28 11:55:25,202 p=356348 u=joel-livingstone-kofi-ackah n=ansible INFO| TASK [Display deployment information] *********************************************************************************************************
2026-01-28 11:55:25,221 p=356348 u=joel-livingstone-kofi-ackah n=ansible INFO| ok: [webapp] => {
    "msg": "Deploying Todo App to 34.243.244.28\nRepository: https://github.com/KofiAckah/Deploy_n_Configure-Web_App.git\nApp Directory: /var/www/todoapp\n"
}
2026-01-28 11:55:25,225 p=356348 u=joel-livingstone-kofi-ackah n=ansible INFO| TASK [Update system packages] *****************************************************************************************************************
2026-01-28 11:55:41,122 p=356348 u=joel-livingstone-kofi-ackah n=ansible INFO| ok: [webapp]
2026-01-28 11:55:41,134 p=356348 u=joel-livingstone-kofi-ackah n=ansible INFO| TASK [Add MongoDB repository] *****************************************************************************************************************
2026-01-28 11:55:49,072 p=356348 u=joel-livingstone-kofi-ackah n=ansible INFO| changed: [webapp]
2026-01-28 11:55:49,077 p=356348 u=joel-livingstone-kofi-ackah n=ansible INFO| TASK [Install MongoDB] ************************************************************************************************************************
2026-01-28 11:56:09,763 p=356348 u=joel-livingstone-kofi-ackah n=ansible INFO| changed: [webapp]
2026-01-28 11:56:09,773 p=356348 u=joel-livingstone-kofi-ackah n=ansible INFO| TASK [Start and enable MongoDB service] *******************************************************************************************************
2026-01-28 11:56:14,464 p=356348 u=joel-livingstone-kofi-ackah n=ansible INFO| changed: [webapp]
2026-01-28 11:56:14,468 p=356348 u=joel-livingstone-kofi-ackah n=ansible INFO| TASK [Wait for MongoDB to be ready] ***********************************************************************************************************
2026-01-28 11:56:23,048 p=356348 u=joel-livingstone-kofi-ackah n=ansible INFO| ok: [webapp]
2026-01-28 11:56:23,059 p=356348 u=joel-livingstone-kofi-ackah n=ansible INFO| TASK [Install Node.js repository (NodeSource)] ************************************************************************************************
2026-01-28 11:56:28,042 p=356348 u=joel-livingstone-kofi-ackah n=ansible INFO| changed: [webapp]
2026-01-28 11:56:28,046 p=356348 u=joel-livingstone-kofi-ackah n=ansible INFO| TASK [Install Node.js and npm] ****************************************************************************************************************
2026-01-28 11:56:36,510 p=356348 u=joel-livingstone-kofi-ackah n=ansible INFO| changed: [webapp]
2026-01-28 11:56:36,514 p=356348 u=joel-livingstone-kofi-ackah n=ansible INFO| TASK [Verify Node.js installation] ************************************************************************************************************
2026-01-28 11:56:40,325 p=356348 u=joel-livingstone-kofi-ackah n=ansible INFO| ok: [webapp]
2026-01-28 11:56:40,331 p=356348 u=joel-livingstone-kofi-ackah n=ansible INFO| TASK [Display Node.js version] ****************************************************************************************************************
2026-01-28 11:56:40,348 p=356348 u=joel-livingstone-kofi-ackah n=ansible INFO| ok: [webapp] => {
    "msg": "Node.js version: v20.20.0"
}
2026-01-28 11:56:40,352 p=356348 u=joel-livingstone-kofi-ackah n=ansible INFO| TASK [Install Git] ****************************************************************************************************************************
2026-01-28 11:56:46,423 p=356348 u=joel-livingstone-kofi-ackah n=ansible INFO| changed: [webapp]
2026-01-28 11:56:46,428 p=356348 u=joel-livingstone-kofi-ackah n=ansible INFO| TASK [Create application directory] ***********************************************************************************************************
2026-01-28 11:56:50,161 p=356348 u=joel-livingstone-kofi-ackah n=ansible INFO| changed: [webapp]
2026-01-28 11:56:50,165 p=356348 u=joel-livingstone-kofi-ackah n=ansible INFO| TASK [Clone application from GitHub] **********************************************************************************************************
2026-01-28 11:56:54,414 p=356348 u=joel-livingstone-kofi-ackah n=ansible INFO| changed: [webapp]
2026-01-28 11:56:54,418 p=356348 u=joel-livingstone-kofi-ackah n=ansible INFO| TASK [Navigate to webapp folder] **************************************************************************************************************
2026-01-28 11:56:59,071 p=356348 u=joel-livingstone-kofi-ackah n=ansible INFO| ok: [webapp]
2026-01-28 11:56:59,075 p=356348 u=joel-livingstone-kofi-ackah n=ansible INFO| TASK [Display webapp contents] ****************************************************************************************************************
2026-01-28 11:56:59,092 p=356348 u=joel-livingstone-kofi-ackah n=ansible INFO| ok: [webapp] => {
    "msg": [
        "total 76",
        "drwxrwxr-x. 6 ec2-user ec2-user   178 Jan 28 11:56 .",
        "drwxr-xr-x. 8 ec2-user ec2-user   129 Jan 28 11:56 ..",
        "-rw-rw-r--. 1 ec2-user ec2-user   140 Jan 28 11:56 .env.example",
        "-rw-rw-r--. 1 ec2-user ec2-user    35 Jan 28 11:56 .gitignore",
        "-rw-rw-r--. 1 ec2-user ec2-user  3624 Jan 28 11:56 README.md",
        "drwxrwxr-x. 2 ec2-user ec2-user    21 Jan 28 11:56 models",
        "-rw-rw-r--. 1 ec2-user ec2-user 54768 Jan 28 11:56 package-lock.json",
        "-rw-rw-r--. 1 ec2-user ec2-user   548 Jan 28 11:56 package.json",
        "drwxrwxr-x. 4 ec2-user ec2-user    27 Jan 28 11:56 public",
        "drwxrwxr-x. 2 ec2-user ec2-user    22 Jan 28 11:56 routes",
        "-rw-rw-r--. 1 ec2-user ec2-user  1437 Jan 28 11:56 server.js",
        "drwxrwxr-x. 2 ec2-user ec2-user    23 Jan 28 11:56 views"
    ]
}
2026-01-28 11:56:59,096 p=356348 u=joel-livingstone-kofi-ackah n=ansible INFO| TASK [Install npm dependencies] ***************************************************************************************************************
2026-01-28 11:57:05,662 p=356348 u=joel-livingstone-kofi-ackah n=ansible INFO| changed: [webapp]
2026-01-28 11:57:05,666 p=356348 u=joel-livingstone-kofi-ackah n=ansible INFO| TASK [Create .env file for production] ********************************************************************************************************
2026-01-28 11:57:13,619 p=356348 u=joel-livingstone-kofi-ackah n=ansible INFO| changed: [webapp]
2026-01-28 11:57:13,623 p=356348 u=joel-livingstone-kofi-ackah n=ansible INFO| TASK [Create systemd service file for Node.js app] ********************************************************************************************
2026-01-28 11:57:21,116 p=356348 u=joel-livingstone-kofi-ackah n=ansible INFO| changed: [webapp]
2026-01-28 11:57:21,121 p=356348 u=joel-livingstone-kofi-ackah n=ansible INFO| TASK [Reload systemd daemon] ******************************************************************************************************************
2026-01-28 11:57:25,116 p=356348 u=joel-livingstone-kofi-ackah n=ansible INFO| ok: [webapp]
2026-01-28 11:57:25,120 p=356348 u=joel-livingstone-kofi-ackah n=ansible INFO| TASK [Start and enable Todo App service] ******************************************************************************************************
2026-01-28 11:57:29,213 p=356348 u=joel-livingstone-kofi-ackah n=ansible INFO| changed: [webapp]
2026-01-28 11:57:29,216 p=356348 u=joel-livingstone-kofi-ackah n=ansible INFO| TASK [Wait for Node.js app to start] **********************************************************************************************************
2026-01-28 11:57:35,550 p=356348 u=joel-livingstone-kofi-ackah n=ansible INFO| ok: [webapp]
2026-01-28 11:57:35,554 p=356348 u=joel-livingstone-kofi-ackah n=ansible INFO| TASK [Install Nginx] **************************************************************************************************************************
2026-01-28 11:57:41,220 p=356348 u=joel-livingstone-kofi-ackah n=ansible INFO| changed: [webapp]
2026-01-28 11:57:41,224 p=356348 u=joel-livingstone-kofi-ackah n=ansible INFO| TASK [Configure Nginx as reverse proxy] *******************************************************************************************************
2026-01-28 11:57:48,860 p=356348 u=joel-livingstone-kofi-ackah n=ansible WARNING| [WARNING]: Deprecation warnings can be disabled by setting `deprecation_warnings=False` in ansible.cfg.

2026-01-28 11:57:48,860 p=356348 u=joel-livingstone-kofi-ackah n=ansible INFO| [DEPRECATION WARNING]: INJECT_FACTS_AS_VARS default to `True` is deprecated, top-level facts will not be auto injected after the change. This feature will be removed from ansible-core version 2.24.
Origin: /home/joel-livingstone-kofi-ackah/Desktop/Labs/Deploy&Configure_ Web_App/Ansible/site.yml:184:18

182       copy:
183         dest: /etc/nginx/conf.d/{{ app_name }}.conf
184         content: |
                     ^ column 18

Use `ansible_facts["fact_name"]` (no `ansible_` prefix) instead.


2026-01-28 11:57:48,860 p=356348 u=joel-livingstone-kofi-ackah n=ansible INFO| changed: [webapp]
2026-01-28 11:57:48,863 p=356348 u=joel-livingstone-kofi-ackah n=ansible INFO| TASK [Remove default Nginx configuration] *****************************************************************************************************
2026-01-28 11:57:52,161 p=356348 u=joel-livingstone-kofi-ackah n=ansible INFO| changed: [webapp]
2026-01-28 11:57:52,165 p=356348 u=joel-livingstone-kofi-ackah n=ansible INFO| TASK [Test Nginx configuration] ***************************************************************************************************************
2026-01-28 11:57:55,475 p=356348 u=joel-livingstone-kofi-ackah n=ansible INFO| ok: [webapp]
2026-01-28 11:57:55,479 p=356348 u=joel-livingstone-kofi-ackah n=ansible INFO| TASK [Display Nginx test results] *************************************************************************************************************
2026-01-28 11:57:55,496 p=356348 u=joel-livingstone-kofi-ackah n=ansible INFO| ok: [webapp] => {
    "msg": [
        "nginx: the configuration file /etc/nginx/nginx.conf syntax is ok",
        "nginx: configuration file /etc/nginx/nginx.conf test is successful"
    ]
}
2026-01-28 11:57:55,500 p=356348 u=joel-livingstone-kofi-ackah n=ansible INFO| TASK [Start and enable Nginx] *****************************************************************************************************************
2026-01-28 11:57:59,471 p=356348 u=joel-livingstone-kofi-ackah n=ansible INFO| changed: [webapp]
2026-01-28 11:57:59,482 p=356348 u=joel-livingstone-kofi-ackah n=ansible INFO| TASK [Check if Todo App is responding] ********************************************************************************************************
2026-01-28 11:58:03,103 p=356348 u=joel-livingstone-kofi-ackah n=ansible INFO| ok: [webapp]
2026-01-28 11:58:03,107 p=356348 u=joel-livingstone-kofi-ackah n=ansible INFO| TASK [Display application health status] ******************************************************************************************************
2026-01-28 11:58:03,134 p=356348 u=joel-livingstone-kofi-ackah n=ansible INFO| ok: [webapp] => {
    "msg": "Application Status: OK"
}
2026-01-28 11:58:03,138 p=356348 u=joel-livingstone-kofi-ackah n=ansible INFO| TASK [Display deployment summary] *************************************************************************************************************
2026-01-28 11:58:03,158 p=356348 u=joel-livingstone-kofi-ackah n=ansible INFO| [DEPRECATION WARNING]: INJECT_FACTS_AS_VARS default to `True` is deprecated, top-level facts will not be auto injected after the change. This feature will be removed from ansible-core version 2.24.
Origin: /home/joel-livingstone-kofi-ackah/Desktop/Labs/Deploy&Configure_ Web_App/Ansible/site.yml:244:14

242     - name: Display deployment summary
243       debug:
244         msg: |
                 ^ column 14

Use `ansible_facts["fact_name"]` (no `ansible_` prefix) instead.


2026-01-28 11:58:03,158 p=356348 u=joel-livingstone-kofi-ackah n=ansible INFO| ok: [webapp] => {
    "msg": "✅ DEPLOYMENT SUCCESSFUL!\n━━━━━━━━━━━━━━━━━━━━━━━━━━━━━━━━━━━━━━━━\n📦 Application: Todo App\n Access URL: http://10.0.1.59\n🔗 Health Check: http://10.0.1.59/health\n App Directory: /var/www/todoapp/webapp\n🗄️  Database: MongoDB running on port 27017\n🚀 Node.js App: Running on port 3000\n🔄 Nginx: Reverse proxy configured\n📊 Service: systemctl status todoapp\n📋 Logs: journalctl -u todoapp -f\n"
}
2026-01-28 11:58:03,165 p=356348 u=joel-livingstone-kofi-ackah n=ansible INFO| RUNNING HANDLER [Restart Nginx] ***************************************************************************************************************
2026-01-28 11:58:07,005 p=356348 u=joel-livingstone-kofi-ackah n=ansible INFO| changed: [webapp]
2026-01-28 11:58:07,006 p=356348 u=joel-livingstone-kofi-ackah n=ansible INFO| PLAY RECAP ************************************************************************************************************************************
2026-01-28 11:58:07,006 p=356348 u=joel-livingstone-kofi-ackah n=ansible INFO| webapp                     : ok=32   changed=17   unreachable=0    failed=0    skipped=0    rescued=0    ignored=0   
